contest, year, T1, T2, T3, E1, E2, T4, T5
ipho,2025,Hydrogen and galaxies,Cox's Timepiece,Champagne!,Earth's magnetic field measurement,Sand craters and dunes,Strongly correlated Fermi gases (Theory Backup),
ipho,2024,Greenhouse Effect,Trapping Ions and Cooling Atoms,Black Widow Pulsar,Heat Conduction in a Copper Rod,Diffraction from Phase Steps,,
ipho,2023,Soil Colloids,Neutron Stars,Water and Objects,Mass Measurement,Birefringence,,
ipho,2022,Permanent magnets,James Webb Space Telescope,Scaling laws,Planet,Cylindrical Diode,,
ipho,2021,Planetary Physics,Electrostatic Lens,Particles and Waves,Non-ideal Capacitors,LEDs,,
ipho,2020,Problem Mix,Anisotropic Friction,Laser Technologies,Crystallography,,,
ipho,2019,Zero-length springs and slinky coils,Microwave Oven,Thermoacoustic Engine,Optical Measurements,Wiedemann-Franz Law,,
ipho,2018,LIGO-GW150914,Where is the neutrino?,Physics of Live Systems,Paper transistor,Viscoelasticity of a polymer thread,,
ipho,2016,Two Problems in Mechanics,Nonlinear Dynamics in Electric Circuits,Large Hadron Collider,Electrical conductivity,Jumping beads,,